id,abbr,name,publisher,url,class,type,category
642,ISBRA,International Symposium on Bioinformatics Research and Applications,Springer,https://dblp.uni-trier.de/db/conf/isbra/,C,Conference,10
643,SAGT,International Symposium on Algorithmic Game Theory,Springer,https://dblp.org/db/conf/sagt/index.html,C,Conference,10
644,SIGSPATIAL,ACM Special Interest Group on Spatial Information,ACM,https://dblp.org/db/journals/sigspatial/index.html,C,Conference,10
645,ICIC,International Conference on Intelligent Computing,Springer-Nature,https://dblp.org/db/conf/icic/index.html,C,Conference,10
646,ICLR,International Conference on Learning Representations,OpenReview.net,https://dblp.uni-trier.de/db/conf/iclr/,A,Conference,8
647,WMT,Conference on Machine Translation,,https://dblp.uni-trier.de/db/conf/wmt/,,Conference,8
